{
  "$schema": "http://json-schema.org/draft-07/schema#",
  "$id": "tracksmart/inventory/inventory_categories.json",
  "title": "inventory_categories",
  "description": "The 12 built-in categories plus any the carrier adds in the \"Item Category\" modal. Drives the category rail, the item form dropdown, the vendor category and the item icon.",
  "type": "object",
  "additionalProperties": false,
  "properties": {
    "_id": {
      "type": "string",
      "description": "\"cat-fuel-card\" for built-ins; \"cat-<ObjectId>\" for custom."
    },
    "carrierId": {
      "type": [
        "string",
        "null"
      ],
      "description": "null = built-in (shared by every carrier); set = this carrier's own."
    },
    "name": {
      "type": "string",
      "description": "Unique per carrier, case-insensitive (\"Category name is required.\", \"A category named … already exists.\")."
    },
    "nameLower": {
      "type": "string",
      "description": "Lower-cased name, written by the server; backs the unique index."
    },
    "description": {
      "type": "string",
      "default": ""
    },
    "builtIn": {
      "type": "boolean",
      "description": "Built-ins cannot be renamed or deleted (TO CONFIRM — the prototype allows both in memory).",
      "default": false
    },
    "icon": {
      "type": "string",
      "description": "lucide icon name (\"Fuel\", \"KeyRound\").",
      "default": "Layers"
    },
    "palette": {
      "type": "string",
      "description": "Tailwind hue for the tile (\"amber\").",
      "default": "slate"
    },
    "sortOrder": {
      "type": "integer",
      "default": 0
    },
    "createdAt": {
      "type": "string",
      "format": "date-time",
      "description": "Set by the server on insert."
    },
    "updatedAt": {
      "type": "string",
      "format": "date-time",
      "description": "Set by the server on every write."
    }
  },
  "required": [
    "_id",
    "name",
    "nameLower",
    "builtIn",
    "createdAt",
    "updatedAt"
  ]
}